{
  "schema_version": "0.1",
  "profile": "smoke",
  "dev_manifest": "configs/experiments/phase1/manifests/dev-v1.json",
  "test_manifest": "configs/experiments/phase1/manifests/test-v1.json",
  "worlds": ["switchworld", "reliability_world", "delayed_evidence_world", "contradiction_world", "multi_object_world", "goal_conflict_world"],
  "dev_episodes_per_world": 2,
  "test_episodes_per_world": 2,
  "steps": 8,
  "run_seeds": [101],
  "parameter_target": 9900,
  "compute_target": 1188000,
  "optimizer_steps": 5,
  "learning_rate": 0.003,
  "torch_threads": 1,
  "trial_budget_per_family": 12,
  "context_limit": 64,
  "hard_timeout_seconds": 600
}
